priority,id,year,brand,title,category,description,price,style,saves,siteURL,imageURL
54,2023Joh54,2023,John Elliott,DAKOTA KNIT OVERSIZED CREW,tops,"Oversized crewneck sweater in chunky merino wool. Dropped shoulder design. Two concealed welt pockets at the waist. Ribbed collar and cuffs.

Featuring chunky 100% merino wool construction with a half cardigan stitch, this sweater is knitted on a rare five gauge machine that mimics a hand loom, for substantially weighted garments. Due to the heavy-weight make, it can function as a top layer in the cold.",498,city,0,https://www.johnelliott.com/products/dakota-knit-oversized-crew-black,https://www.johnelliott.com/cdn/shop/files/DAKOTA_KNIT_OVERSIZED_CREW_BLACK_FLAT_1424x.jpg?v=1695689052
55,2023Joh55,2023,John Elliott,WOOL MOHAIR CARDIGAN,tops,"Cardigan sweater in a relaxed, drop shoulder fit. Features a button closure, rib knit shawl, cuffs, and hem. This garment is knit with a soft fisherman-rib wool and mohair blend. Its distinctive shaggy surface has been heavily brushed to reveal character underneath. Due to the special treatment of this knit, each piece is completely unique, with slight variance in finish.",498,surf,0,https://www.johnelliott.com/products/wool-mohair-cardigan-camel,https://www.johnelliott.com/cdn/shop/files/WOOL_MOHAIR_CARDIGAN_CAMEL_FLAT_1424x.jpg?v=1693603238
56,2023Joh56,2023,John Elliott,FOLSOM CROPPED TEE,tops,"Slightly cropped tee with a boxy, vintage inspired fit. Designed with custom knit cotton. Ribbed neck. Wash finish with light distressing at the collar and hems. Made in Los Angeles.

The Folsom Group is based off a vintage find that's been washed and worn for many years. Part of our brand's ethos is to develop products with intention and character. This garment is created with that mindset - From the way the fabric is knit, to washed, to the hand feel, mixed with distressing. Due to the special treatment on this tee, each piece is completely unique, with slight variance in finish.",158,surf,0,https://www.johnelliott.com/products/folsom-cropped-tee-vintage-dusty-blue,https://www.johnelliott.com/cdn/shop/products/230326_FOLSOMCROPPEDTEE_VINTAGEDUSTYBLUE_FLAT_1424x.jpg?v=1680904340
57,2023Joh57,2023,John Elliott,HAZE LOW SUEDE,shoes,"Low top sneaker in suede. Suede upper with contrast toe panel. Calf leather lining at the tongue and heel. Stitched sole construction. White eyelets. Branded green insole. Made by hand in Italy.

We approached footwear as we do any category - by solving our own problems. Brand codes, that we’ve crafted over the last nine years, are embedded in the design language, like layering and transparency. The entire range is made in Northern Italy, near Florence. We use beautiful materials that will last.",198,surf,0,https://www.johnelliott.com/products/haze-low-suede-moon-grey,https://www.johnelliott.com/cdn/shop/products/220107_HAZE_LOW_SUEDE_GREY_06_1424x.jpg?v=1641522053
58,2023Joh58,2023,John Elliott,VINTAGE VARSITY SHORTS,shorts,"Hoops-inspired mesh shorts in our new cropped and tailored fit. Two pocket styling with a ribbed drawstring waist and double knit striped trim with vented cuffs. Fully lined.

These shorts are inspired by players who defined the era of basketball from the 80's - early 90's. They reference vintage Americana - A stylistic way of athletic dressing with cropped shorts and closer to the body uniforms.",228,city,0,https://www.johnelliott.com/products/vintage-varsity-shorts-thistle,https://www.johnelliott.com/cdn/shop/products/VINTAGE_VARSITY_SHORTS_SALT_X_THISTLE_04_1424x.jpg?v=1675730760
59,2023Joh59,2023,John Elliott,LEATHER PICO PUFFER,tops,"Quilted puffer jacket in premium 0.4mm European cowhide leather. Water repellant finish. This style features a stand collar, zip closure at the front, elasticized cuffs, snap welt pockets at the waist, and a bungee-style drawstring at the hem. Zippered pocket at interior. Riri hardware. Thermolite fill for superior warmth. Made in Los Angeles",2498,city,0,https://www.johnelliott.com/products/leather-pico-puffer-taupe,https://www.johnelliott.com/cdn/shop/products/230105_LEATHER_PICO_PUFFER_TAUPE_04_1424x.jpg?v=1672879814
60,2023Joh60,2023,John Elliott,JE X MASTERMIND WORKED UTILITY PANT,bottoms,Relaxed fit straight leg pants in brushed heavyweight back sateen fabric. Garment dyed and stonewashed. Two pockets at the front and welt pockets at the seat. Paneled construction at the knees. Zip closure waist with waistband loops and darts. Ghost-stitching at traditional cargo pocket areas. Paint splatters throughout. Mastermind branding. Made in Japan.,1198,city,0,https://www.johnelliott.com/products/je-x-mastermind-worked-utility-pant-washed-black,https://www.johnelliott.com/cdn/shop/files/JE_MASTERMIND_WORKED_UTILITY_PANT_WASHED_BLACK_05_1424x.jpg?v=1701472847
61,2023Joh61,2023,John Elliott,CAMP SHIRT,tops,"Graphic 'Tuscan Floral' print camp shirt in newly developed cotton / rayon blend fabric that's knit for a soft, smooth hand. This shirt features a button placket, chest pocket, and point collar. The relaxed, easy silhouette is designed to elevate any fit, whether paired with semi-formal trousers or more casual shorts. Fits boxy by design. If you prefer a slimmer fit, it's possible to size down.",298,city,0,https://www.johnelliott.com/products/camp-shirt-beige-tuscan-floral,https://www.johnelliott.com/cdn/shop/products/230212_CAMP_SHIRT_BEIGE_TUSCAN_FLORAL_FLAT_1424x.jpg?v=1676063039
62,2023Joh62,2023,John Elliott,KATHMANDU WOOL THROW,accessories,"Rectangular throw in yak wool. Hand-woven by Nepali artisans with a traditional multi-colored Tibetan motif. L: 104"" (Tassel to Tassel) X W: 46."" Made in Nepal.",148,surf,0,https://www.johnelliott.com/products/kathmandu-wool-throw-blue-multi,https://www.johnelliott.com/cdn/shop/files/KATHMANDU-WOOL-THROW---BLUE-MULTI-02_1424x.jpg?v=1700701353
63,2023Joh63,2023,John Elliott,REPLICA HOODIE,tops,"Pullover hoodie in custom super heavyweight 26 oz. terry with a soft fleeced backside. Classic boxy fit. Kangaroo pocket at the waist, tonal drawstring closure at the hood. Rib knit waist and cuffs. Made in Los Angeles.

The Replica Collection is informed by John's early days in San Francisco. During his time on Haight Street, vintage references were accumulated that would become foundational blocks for our brand. Replica Fleece is our version of heavyweight sweats circa the 1970's. These garments feature a clean face that's washed out, and are something we feel is an important pillar for anyone's wardrobe.",398,surf,0,https://www.johnelliott.com/products/replica-hoodie-vintage-black,https://www.johnelliott.com/cdn/shop/products/REPLICA_HOODIE_BLACK_FLAT_1424x.jpg?v=1662300253
64,2023Joh64,2023,John Elliott,HEMI OVERSIZED SHIRT,tops,"This classic Hemi Shirt has a relaxed fit with a raw hem, button placket, chest pocket, barrel cuffs, and a point collar. Designed in custom-woven ""Aspen Check,"" each piece goes through a proprietary wash process and hand-brushed finish. The result is supremely soft fabrication with a uniquely faded, vintage appearance. Made in Japan.",398,surf,0,https://www.johnelliott.com/products/hemi-oversized-shirt-aspen-check,https://www.johnelliott.com/cdn/shop/files/HEMI_OVERSIZED_SHIRT_ASPEN_CHECK_FLAT_1424x.jpg?v=1693250259
